done,pid,label,speaker,_date,time,topics,local_image,original_image,order,layout,collection
TRUE,img01,Web Development Class Zoom,Zach Coble,"January 25, 2022",6:20 PM,"class, Zoom",img01.jpg,20220125-WebDevZoom.jpg,00,sketches_item,sketches
TRUE,img02,Web Development Class Zoom,Zach Coble,"February 1, 2022",6:20 PM,"class, Zoom",img02.jpg,20220201-WebDevZoom.jpg,01,sketches_item,sketches
TRUE,img03,Black Global Consciousness,"Ann Morning, Angela Davis","February 2, 2022",10:30 AM,NYU,img03.jpg,20220202-MLKWeek-BlackGlobalConscioussness.jpg,02,sketches_item,sketches
TRUE,img04,NYCDH Week: Support,,"February 7, 2022",2:30 PM,DH,img04.jpg,20220207-NYCDH-Support.jpg,03,sketches_item,sketches
TRUE,img05,NYCDH Week: Kickoff,"Jesse Merandy, Kimon Keramidas, Jennifer Serventi, Katina Rogers, Moacir P. De Sá Pereira, Jim Groom, Jason Rhody","February 7, 2022",12:00 PM,DH,img05.jpg,20220207-NYCDHKickoff.jpg,04,sketches_item,sketches
TRUE,img06,Web Development Class: CSS,Zach Coble,"February 8, 2022",6:20 PM,"class, in-person",img06.jpg,20220208-WebDev-Mercer.jpg,05,sketches_item,sketches
TRUE,img07,NYCDH Week: The Web Is All You Need,Ben Schmidt,"February 10, 2022",3:00 PM,DH,img07.jpg,20220210-NYCDH-DataAnalysis-Ben.jpg,06,sketches_item,sketches
TRUE,img08,NYCDH Week: Seed to Scale,"Elaine Ayers, Ahmed Ansari, Hilke Schellman, Mona Sloane","February 10, 2022",11:00 AM,DH,img08.jpg,20220210-NYCDH-SeedtoScale.jpg,07,sketches_item,sketches
TRUE,img09,Woolf Salon: Friendships Gallery,International Virginia Woolf Society,"February 11, 2022",4:00 PM,literary,img09.jpg,20220211-WoolfSalon.jpg,08,sketches_item,sketches
TRUE,img10,Manifold Meetup,"Krysia Michael, Lauren Tilton","February 15, 2022",11:00 AM,DH,img10.jpg,20220215-ManifoldMeetup.jpg,09,sketches_item,sketches
TRUE,img11,Web Development Class: CSS continued,Zach Coble,"February 15, 2022",6:20 PM,"class, in-person",img11.jpg,20220215-WebDev-websitepresentation.jpg,10,sketches_item,sketches
TRUE,img12,Provost's Postdoctoral Fellow Meeting: Identifying and Securing Funding to Advance Your Research,Elise Capella,"February 16, 2022",12:00 PM,NYU,img12.jpg,20220216-ProvostsPostdoc.jpg,11,sketches_item,sketches
TRUE,img13,Manifold Orientation,,"February 16, 2022",11:00 AM,DH,img13.jpg,20220217-ManifoldOrientation.jpg,12,sketches_item,sketches
TRUE,img14,Teaching Machines,Audrey Watters,"February 17, 2022",4:00 PM,edtech,img14.jpg,20220217-TeachingMachines-Watters.jpg,13,sketches_item,sketches
TRUE,img17,Multimodal Digital Publishing 1,"Inba Kehoe, Cheryl Ball, Dawit Tegbaru","February 24, 2022",2:00 PM,DH,img17.jpg,20220224-MultimodalDigitalPublishing.jpg,14,sketches_item,sketches
TRUE,img16,Multimodal Digital Publishing 2,"Alexandrine Boudreault-Fournier, Susan Frohlick, Tara McPherson, Jenni Schine, Paige Raibmon","February 24, 2022",10:45 AM,DH,img16.jpg,20220224-MultimodalDigitalPublishing1.jpg,15,sketches_item,sketches
TRUE,img15,Multimodal Digital Publishing 3,"Elizabeth Chin, Julia Yezbick","February 24, 2022",9:30 AM,DH,img15.jpg,20220224-MultimodalDigitalPublishing2.jpg,16,sketches_item,sketches
TRUE,img18,Web Development Class: Responsive Design,Zach Coble,"March 1, 2022",6:20 PM,"class, in-person",img18.jpg,20220301-WebDev-inperson.jpg,17,sketches_item,sketches
TRUE,img19,Center for Faculty Advancement: What Is Inclusive Teaching?,"Renee McGarry, Jennifer Lauren","March 2, 2022",,edtech,img19.jpg,20220302-CFA.jpg,18,sketches_item,sketches
TRUE,img20,CRT in Libraries,"Shaundra Walker, April Hathcock, Maria Rios, Isabel Espinal, Betsy Yoon, Kynita Stringer-Stanback","March 4, 2022",,libraries,img20.jpg,20220304-CRTinLibraries.jpg,19,sketches_item,sketches
TRUE,img21,Next Generation Dissertations,"Katina Rogers, Justin Schell, Sonia Estima, Mary Kalantzis, Jesse Merandy, Matt Gold, Kay Sohini, Ana Rodriguez-Rodriguez","March 7, 2022",,DH,img21.jpg,20220307-NextGenDiss.jpg,20,sketches_item,sketches
TRUE,img22,Iris Bierlein,Iris Bierlein,"March 8, 2022",6:20 AM,"class, in-person",img22.jpg,20220308-Iris-inset.jpg,21,sketches_item,sketches
TRUE,img23,Web Development Class: UX,"Zach Coble, Iris Bierlein","March 8, 2022",6:20 PM,"class, in-person",img23.jpg,20220308-WebDev-UX-Iris.jpg,22,sketches_item,sketches
TRUE,img53,SPARC Breaking Down Silos in Open Education: Strategies for Collaboration,,"March 8, 2022",1:00 PM,edtech,img53.jpg,20220308-SPARC.jpg,23,sketches_item,sketches
TRUE,img24,Kevorkian Center: Elements of Boarder and Infrastructure: Earth II,"Nimrob Ben Zeev, Ana Sekulic, Omer Shah","March 9, 2022",12:30 PM,NYU,img24.jpg,20220309-Kevo.jpg,24,sketches_item,sketches
TRUE,img25,Controlled Digital Lending,,"March 10, 2022",2:00 PM,libraries,img25.jpg,20220310-ControlledDigitalLending.jpg,25,sketches_item,sketches
TRUE,img26,On Freedom: Maggie Nelson and Wayne Koestenbaum,"Wayne Koestenbaum, Maggie Nelson","March 10, 2022",7:30 PM,literary,img26.jpg,20220310-Nelson-Koestenbaum.jpg,26,sketches_item,sketches
TRUE,img27,Washington Square Arch,,"March 10, 2022",,sketch,img27.jpg,20220310-websitesketch-WashingtonSq.jpg,27,sketches_item,sketches
TRUE,img28,New Hampshire,,"March 14, 2022",,sketch,img28.jpg,20220314-NH.jpg,28,sketches_item,sketches
TRUE,img29,Web Development Midterm,,"March 22, 2022",,"class, in-person",img29.jpg,20220322-WebDev-midterm.jpg,29,sketches_item,sketches
TRUE,img30,Web Development Class: CMSes,Zach Coble,"March 29, 2022",6:20 PM,"class, in-person",img30.jpg,20220329-WebDev-CMS.jpg,30,sketches_item,sketches
TRUE,img32,Getty Villa Public Programs: What to Do with a Smashed Statue from Antiquity and Today,,"March 30, 2022",2:00 PM,public humanities,img32.jpg,20220330-Getty-Monuments.jpg,31,sketches_item,sketches
TRUE,img33,Kevorkian Center: Elements of Border and Infrastructure: Air II,"Gökçe Günel, Waleed Hazbun, Andrea Stanton, Jared McCormick","March 30, 2022",12:30 p,NYU,img33.jpg,20220330-Kevo-AirII.jpg,32,sketches_item,sketches
TRUE,img34,Manifold Meeting,Manifold team,"March 30, 2022",3:00 PM,DH,img34.jpg,20220330-Manifold.jpg,33,sketches_item,sketches
TRUE,img35,Disability Studies Quarterly Launch,"Liz Ellis, Susan Burch, Ella Callow, Juliet Larkin-Gilmore","March 31, 2022",4:00 PM,public humanities,img35.jpg,20220331-DSQ.jpg,34,sketches_item,sketches
TRUE,img36,Web Development Class: Minimal Computing,Zach Coble,"April 5, 2022",6:20 PM,"class, in-person",img36.jpg,20220405-WebDev-part2-minicomp.jpg,35,sketches_item,sketches
TRUE,img37,Web Development Class: Colors,Zach Coble,"April 5, 2022",8:00 PM,"class, in-person",img37.jpg,20220405-WebDevColors.jpg,36,sketches_item,sketches
TRUE,img38,Kevorkian Center: Elements of Borders and Infrastructure: Fire II,"Natasha Iskander, Ali Ismail Karimi, Feras Klenk, Jared McCormick","April 6, 2022",12:30 PM,NYU,img38.jpg,20220406-KevoFireII.jpg,37,sketches_item,sketches
TRUE,img39,Culture Mapping 2022: Archives & Afterlives,"Tom Augst, Nicholas Wolf","April 7, 2022",4:00 PM,"DH, public humanities",img39.jpg,20220407-CultureMapping.jpg,38,sketches_item,sketches
TRUE,img40,Library Lab: Creating a Fulfilling Career with Design Thinking,"Sarah Stein Greenberg, Scott doorley","April 7, 2022",12:00 PM,libraries,img40.jpg,20220407-LibraryLab.jpg,39,sketches_item,sketches
TRUE,img41,International Virginia Woolf Society Celebrates the Oxford University Press Handbook of Virginia Woolf,"Anne Fernald, Urmila Seshagiri, Claire Davison, Mary Wilson, Roxane Robinson, Vara Neverow, Ben Hagen","April 8, 2022",3:00 PM,literary,img41.jpg,20220408-IVWS-OUP.jpg,40,sketches_item,sketches
TRUE,img42,Web Development Class: Sustainability and Stewardship,Zach Coble,"April 12, 2022",6:20 PM,"class, Zoom",img42.jpg,20220412-WebDev-Zoom.jpg,41,sketches_item,sketches
TRUE,img54,Fairleigh Dickinson University: Myth and Nostalgia in America,"Bruce Peabody, Gloria Pastorino, Ken Sammond","April 11, 2022",7:00 PM,literary,img54.jpg,20220411_FDU.jpg,42,sketches_item,sketches
TRUE,img43,Reverie 3: Wayne Koestenbaum and Gabriel Ojeda Sagué,"Wayne Koestenbaum, Gabriel Ojeda Sagué","April 14, 2022",7:00 PM,literary,img43.jpg,20220414-WayneGabriel.jpg,43,sketches_item,sketches
TRUE,img44,Covid Collections: Documenting the Pandemic Roundtable Discussion,"Jacob Remes, Valerie Marlowe, Ellen Noonan, Libby Bischof, Lauren Hall-Lew, Mark Tebeau","April 17, 2022",12:00 PM,"DH, public humanities",img44.jpg,20220417-Covid-Collections.jpg,44,sketches_item,sketches
TRUE,img45,Web Development Class with Alex Provo,Alex Provo,"April 18, 2022",6:20 PM,"class, in-person",img45.jpg,20220418_WebDev_Provo.jpg,45,sketches_item,sketches
TRUE,img46,Aesthetics of Access in Dance,"Yo-Yo Lin, Kayla Hamilton, Christopher Unpezverde Nuñez","April 21, 2022",4:00 PM,"public humanities, performance",img46.jpg,20220421_AestheticsofAccess.jpg,46,sketches_item,sketches
TRUE,img47,The State of Sustainability Address ,"President Andy Hamilton, Provost Katy Fleming, Chief Sustainability Officer Cecil Scheib, and others","April 21, 2022",5:00 PM,NYU,img47.jpg,20220421_NYUSustainability.jpg,47,sketches_item,sketches
TRUE,img48,NYPL Live: The Internet Archive at 25,"Brewster Kahle, Tony Marx","April 25, 2022",7:00 PM,"libraries, public humanities",img48.jpg,20220425-NYPLLiveKahleMarx.jpg,48,sketches_item,sketches
TRUE,img49,Exoticizing in Collecting Institutions: Confronting the Façade of Representation in Colonial Knowledge Systems and Creating Tactics for Indigenous Agency,Durante Blais-Billie,"April 26, 2022",1:00 PM,"public humanities, libraries",img49.jpg,20220426_BlaisBillie_Exoticizing.jpg,49,sketches_item,sketches
TRUE,img50,Technology and Digital Tools Drop-In,Sam Mandani,"April 26, 2022",2:00 PM,edtech,img50.jpg,20220426_TechandDigitalTools.jpg,50,sketches_item,sketches
TRUE,img51,Web Development Class with David Arjanik,David Arjanik,"April 26, 2022",6:20 PM,"class, in-person",img51.jpg,20220426_WebDev_Arjanik.jpg,51,sketches_item,sketches
TRUE,img52,Open Humanities Seminar Series,Barbara McGillivray,"April 27, 2022",9:00 AM,"humanities data, open humanities, open data",img52.jpg,20220427_OpenHumanitiesData.jpg,52,sketches_item,sketches
